{
  "metadata": {
    "generated_at": "2026-05-06T18:53:45.662Z",
    "input_dir": "E:\\GITHUB-RES\\Feishu\\data\\outputs\\demo\\case06\\auto",
    "evaluation_id": "EVAL-PJT-CASE-06-MTG-CASE-06-12",
    "project_id": "PJT-CASE-06",
    "manager_id": "MGR-CASE-06",
    "package_type": "output_layer_input"
  },
  "workspace_home": [
    {
      "module_id": "人员评估总览看板",
      "平台视角": "评估看板",
      "模块说明": "看本轮评估对象、状态、数据覆盖和报告入口。",
      "入口链接": "https://jcneyh7qlo8i.feishu.cn/base/Z6d9bO5UqajK01swK9CcoGU9nkf?table=tblfQS3bHVLNavvZ",
      "推荐使用人": "HRBP / 评审负责人",
      "展示状态": "启用",
      "关联数据表": [
        "people_overview",
        "evaluation_runs"
      ],
      "备注": "系统首页入口配置"
    },
    {
      "module_id": "单人评估看板",
      "平台视角": "评估看板",
      "模块说明": "看单个中层的综合评分、五维形状和阻断项。",
      "入口链接": "https://jcneyh7qlo8i.feishu.cn/base/Z6d9bO5UqajK01swK9CcoGU9nkf?dashboard=blkwsVk95GtFvTLA",
      "推荐使用人": "上级管理者 / HRBP",
      "展示状态": "启用",
      "关联数据表": [
        "evaluation_runs",
        "dimension_results",
        "metric_results"
      ],
      "备注": "系统首页入口配置"
    },
    {
      "module_id": "五维结论",
      "平台视角": "维度数据",
      "模块说明": "看五个一级维度的等级、置信度、结论和下钻入口。",
      "入口链接": "https://jcneyh7qlo8i.feishu.cn/base/Z6d9bO5UqajK01swK9CcoGU9nkf?table=tblMUq8orwwRSi1c",
      "推荐使用人": "评审负责人 / 上级管理者",
      "展示状态": "启用",
      "关联数据表": [
        "dimension_results"
      ],
      "备注": "系统首页入口配置"
    },
    {
      "module_id": "五维评审",
      "平台视角": "BI看板",
      "模块说明": "看指标值、样本量、缺失率和数据源质量。",
      "入口链接": "https://jcneyh7qlo8i.feishu.cn/base/Z6d9bO5UqajK01swK9CcoGU9nkf?table=tbldjPFXVZ4PD9RJ",
      "推荐使用人": "PMO / 数据负责人",
      "展示状态": "启用",
      "关联数据表": [
        "metric_results",
        "evidence_index"
      ],
      "备注": "系统首页入口配置"
    },
    {
      "module_id": "人工复核",
      "平台视角": "复核审批",
      "模块说明": "处理低置信、证据冲突、责任归因和补证事项。",
      "入口链接": "https://jcneyh7qlo8i.feishu.cn/base/Z6d9bO5UqajK01swK9CcoGU9nkf?table=tblShT3KAkGRjj1T",
      "推荐使用人": "复核人 / HRBP",
      "展示状态": "启用",
      "关联数据表": [
        "review_items",
        "evidence_index"
      ],
      "备注": "系统首页入口配置"
    },
    {
      "module_id": "证据索引",
      "平台视角": "证据下钻",
      "模块说明": "查看关键证据、冲突证据、权限状态和证据片段。",
      "入口链接": "https://jcneyh7qlo8i.feishu.cn/base/Z6d9bO5UqajK01swK9CcoGU9nkf?table=tblQenU1BAdECcY2",
      "推荐使用人": "复核人 / 审计查看人",
      "展示状态": "启用",
      "关联数据表": [
        "evidence_index"
      ],
      "备注": "系统首页入口配置"
    }
  ],
  "people_overview": [
    {
      "person_id": "MGR-CASE-06",
      "中层姓名": "周牧",
      "所属部门": "",
      "管理范围": "PJT-CASE-06",
      "主责角色": "项目负责人",
      "最新报告状态": "needs_evidence 需补证",
      "最新签字状态": "未签字",
      "最新整体置信度": 0.7,
      "数据覆盖等级": "中",
      "待复核数量": 7,
      "需补证数量": 1,
      "人工复核要求": "需要",
      "主关注维度": [
        "方向校准力",
        "推进闭环力",
        "组织行为健康度"
      ],
      "评估总览": "管理者周牧在PJT-CASE-06项目MTG-CASE-06-12会议期间的表现呈现混合特征。在方向校准上，能基于事实做出清晰判断；在风险治理和协同调度方面，展现了扎实的基础能力和高效的解决推动力。然而，推进闭环流程存在严重脱节和混乱，是当前最突出的管理风险。同时，风险根治效果不足和组织行为中的高压模式是需要持续关注和改进的领域。由于关键证据（完整会议转写）缺失及部分行为观察需语境复核，整体评估置信度有所降级。",
      "数据覆盖结论": "可用数据源：Base 记录、Base 历史、云文档、聊天历史、会议/妙记、日历、通讯录。质量提醒：当前会议没有完整妙记转写，当前会议事实将更多依赖会议表和 Statements。",
      "综合评分": 68.25,
      "评估周期": "2026-01-01 ~ 2026-03-26",
      "单人ReviewPacket": "https://jcneyh7qlo8i.feishu.cn/base/Z6d9bO5UqajK01swK9CcoGU9nkf?dashboard=blkwsVk95GtFvTLA",
      "关联维度": [
        "DIM-EVAL-PJT-CASE-06-MTG-CASE-06-12-方向校准力",
        "DIM-EVAL-PJT-CASE-06-MTG-CASE-06-12-推进闭环力",
        "DIM-EVAL-PJT-CASE-06-MTG-CASE-06-12-风险治理力",
        "DIM-EVAL-PJT-CASE-06-MTG-CASE-06-12-协同调度力",
        "DIM-EVAL-PJT-CASE-06-MTG-CASE-06-12-组织行为健康度"
      ],
      "关联复核项": [
        "review_missing_current_transcript_MTG-CASE-06-12",
        "review_action_task_mapping_MTG-CASE-06-12",
        "HR-001",
        "HR-002",
        "HRV-CORD-001",
        "low_confidence_方向校准力",
        "low_confidence_组织行为健康度"
      ]
    }
  ],
  "evaluation_run": {
    "evaluation_id": "EVAL-PJT-CASE-06-MTG-CASE-06-12",
    "评估包标题": "周牧｜单人 Review Packet",
    "评估对象名称": "周牧",
    "项目范围": "PJT-CASE-06",
    "评估周期": "2026-01-01 ~ 2026-03-26",
    "报告状态": "needs_evidence 需补证",
    "综合评分": 68.25,
    "整体置信度": 0.7,
    "数据覆盖等级": "中",
    "数据覆盖结论": "可用数据源：Base 记录、Base 历史、云文档、聊天历史、会议/妙记、日历、通讯录。质量提醒：当前会议没有完整妙记转写，当前会议事实将更多依赖会议表和 Statements。",
    "人工复核要求": "需要",
    "人审未完成数量": 7,
    "单人ReviewPacket": "https://jcneyh7qlo8i.feishu.cn/base/Z6d9bO5UqajK01swK9CcoGU9nkf?dashboard=blkwsVk95GtFvTLA",
    "签字状态": "未签字",
    "评估总览": "管理者周牧在PJT-CASE-06项目MTG-CASE-06-12会议期间的表现呈现混合特征。在方向校准上，能基于事实做出清晰判断；在风险治理和协同调度方面，展现了扎实的基础能力和高效的解决推动力。然而，推进闭环流程存在严重脱节和混乱，是当前最突出的管理风险。同时，风险根治效果不足和组织行为中的高压模式是需要持续关注和改进的领域。由于关键证据（完整会议转写）缺失及部分行为观察需语境复核，整体评估置信度有所降级。",
    "启用维度": [
      "方向校准力",
      "推进闭环力",
      "风险治理力",
      "协同调度力",
      "组织行为健康度"
    ],
    "五维结论入口": [
      "DIM-EVAL-PJT-CASE-06-MTG-CASE-06-12-方向校准力",
      "DIM-EVAL-PJT-CASE-06-MTG-CASE-06-12-推进闭环力",
      "DIM-EVAL-PJT-CASE-06-MTG-CASE-06-12-风险治理力",
      "DIM-EVAL-PJT-CASE-06-MTG-CASE-06-12-协同调度力",
      "DIM-EVAL-PJT-CASE-06-MTG-CASE-06-12-组织行为健康度"
    ],
    "人工复核入口": [
      "review_missing_current_transcript_MTG-CASE-06-12",
      "review_action_task_mapping_MTG-CASE-06-12",
      "HR-001",
      "HR-002",
      "HRV-CORD-001",
      "low_confidence_方向校准力",
      "low_confidence_组织行为健康度"
    ]
  },
  "dimension_results": [
    {
      "dimension_result_id": "DIM-EVAL-PJT-CASE-06-MTG-CASE-06-12-方向校准力",
      "维度页标题": "方向校准力",
      "中层姓名": "周牧",
      "所属人员": "周牧",
      "评估周期": "2026-01-01 ~ 2026-03-26",
      "维度等级": "健康",
      "维度分数": 75,
      "维度权重": 20,
      "加权得分": 15,
      "置信度": 0.7,
      "是否需复核": true,
      "核心结论": "基于专家软指标加权评估：判断依据充分度(70)、目标/路径修正清晰度(75)、优先级收敛耗时(65)、方向反复次数(90)。管理者在本次会议中基于具体测试结果（续航差15分钟）做出‘软件优化优先’的清晰判断，并与项目风险文档对齐，展现了基于事实的方向校准能力。历史会议决策留痕覆盖率为100%（meeting_decision_coverage_rate=1），表明决策留痕习惯良好。但存在长期未决问题（如外观颜色方案）影响优先级收敛，且因缺少完整会议转写，对整体方向把控的评估受限。",
      "关键证据摘要": "提供了续航问题的具体数据，是后续判断的基础。\n管理者基于测试结果做出的明确方向判断。\nmetric_id=meeting_decision_coverage_rate, formula=value = meetings_with_decision_trace / total_meetings, calculation.expression=12 / 12, value=1。表明历史会议决策留痕良好。",
      "边界说明": "当前会议缺少完整妙记转写，无法全面评估管理者对项目目标、范围等宏观维度的判断依据和讨论过程。\n部分软指标（如优先级收敛耗时）为基于风险状态的代理观察，无法精确测量单次会议的共识耗时。",
      "建议动作": "该维度存在复核项，请从关联复核项进入处理。",
      "关联指标": [
        "MET-EVAL-PJT-CASE-06-MTG-CASE-06-12-meeting_decision_coverage_rate"
      ],
      "关联证据": [
        "EVD-statement-MTG-CASE-06-12-STM-1",
        "EVD-statement-MTG-CASE-06-12-STM-2",
        "EVD-hard_metric-meeting_decision_coverage_rate",
        "EVD-base_risk-NO.704"
      ],
      "关联复核项": [
        "review_missing_current_transcript_MTG-CASE-06-12",
        "low_confidence_方向校准力"
      ]
    },
    {
      "dimension_result_id": "DIM-EVAL-PJT-CASE-06-MTG-CASE-06-12-推进闭环力",
      "维度页标题": "推进闭环力",
      "中层姓名": "周牧",
      "所属人员": "周牧",
      "评估周期": "2026-01-01 ~ 2026-03-26",
      "维度等级": "中等",
      "维度分数": 60,
      "维度权重": 25,
      "加权得分": 15,
      "置信度": 0.8,
      "是否需复核": true,
      "核心结论": "综合硬指标与专家发现：任务延期率15%（6/40）、任务关闭率62.5%（25/40）表明推进存在压力。关键风险是会议行动项（3条）与任务表关联任务（9条）严重不匹配（current_meeting_action_task_rate异常），暴露出任务定义源头和闭环流程的混乱。任务定义完整率100%（40/40）和已关闭任务质量代理指标100%（25/25）表明基础任务管理要素齐全且关闭任务有留痕。会议行动项留痕覆盖率为66.7%（8/12），存在提升空间。",
      "关键证据摘要": "metric_id=task_overdue_rate, formula=value = overdue_tasks / tasks_with_due_date, calculation.expression=6 / 40, value=0.15。表明有15%的任务已延期。\nmetric_id=task_closure_rate, formula=value = closed_tasks / total_tasks, calculation.expression=25 / 40, value=0.625。表明任务关闭率为62.5%。\nmetric_id=current_meeting_action_task_rate, 指标异常明确指出了行动项与任务数量不匹配的核心问题。",
      "边界说明": "会议行动项与任务表的严重脱节（3 vs 9）是重大流程风险，其具体原因（会后扩展、重复挂载）需要人工复核澄清。",
      "建议动作": "该维度存在复核项，请从关联复核项进入处理。",
      "关联指标": [
        "MET-EVAL-PJT-CASE-06-MTG-CASE-06-12-task_definition_completeness_rate",
        "MET-EVAL-PJT-CASE-06-MTG-CASE-06-12-task_overdue_rate",
        "MET-EVAL-PJT-CASE-06-MTG-CASE-06-12-task_closure_rate",
        "MET-EVAL-PJT-CASE-06-MTG-CASE-06-12-closed_task_quality_rate",
        "MET-EVAL-PJT-CASE-06-MTG-CASE-06-12-current_meeting_action_task_rate",
        "MET-EVAL-PJT-CASE-06-MTG-CASE-06-12-meeting_action_item_coverage_rate"
      ],
      "关联证据": [
        "EVD-hard_metric-task_overdue_rate",
        "EVD-hard_metric-task_closure_rate",
        "EVD-hard_metric-current_meeting_action_task_rate",
        "EVD-hard_metric-meeting_action_item_coverage_rate"
      ],
      "关联复核项": [
        "review_action_task_mapping_MTG-CASE-06-12"
      ]
    },
    {
      "dimension_result_id": "DIM-EVAL-PJT-CASE-06-MTG-CASE-06-12-风险治理力",
      "维度页标题": "风险治理力",
      "中层姓名": "周牧",
      "所属人员": "周牧",
      "评估周期": "2026-01-01 ~ 2026-03-26",
      "维度等级": "中等",
      "维度分数": 70,
      "维度权重": 20,
      "加权得分": 14,
      "置信度": 0.8,
      "是否需复核": true,
      "核心结论": "综合硬指标与专家软指标：高等级风险收口率100%（2/2）、风险缓释动作覆盖率100%（10/10）表明基础风险识别与应对机制健全。主要短板在于风险未收口占比30%（3/10）和同类风险复发样本数高（7/10，技术风险5次，成本风险2次），表明风险治理的闭环及时性与根治效果不足。专家软指标‘高等级风险识别覆盖率’(100)、‘风险升级及时率’(80)与‘同类风险复发率’(30)共同支撑了该评分，显示在及时应对高风险方面表现良好，但在预防复发和解决中等级遗留风险方面存在明显缺口。",
      "关键证据摘要": "metric_id=open_risk_rate, formula=open_or_tracking_risks / total_risks, calculation.expression=3 / 10, value=0.3。显示有3个风险未收口。\nmetric_id=repeated_risk_type_count, formula=sum(count(risk_type) where count(risk_type) > 1), calculation.expression=7, value=7。显示技术风险复发5次，成本风险复发2次。\nmetric_id=high_risk_resolution_rate, formula=value = resolved_high_risks / total_high_risks, calculation.expression=2 / 2, value=1。表明高等级风险已全部收口。",
      "边界说明": "风险升级可能通过非记录渠道进行，无法完全捕获。风险分类粒度可能影响复发判断。",
      "建议动作": "该维度存在复核项，请从关联复核项进入处理。",
      "关联指标": [
        "MET-EVAL-PJT-CASE-06-MTG-CASE-06-12-high_risk_resolution_rate",
        "MET-EVAL-PJT-CASE-06-MTG-CASE-06-12-risk_mitigation_action_rate",
        "MET-EVAL-PJT-CASE-06-MTG-CASE-06-12-open_risk_rate",
        "MET-EVAL-PJT-CASE-06-MTG-CASE-06-12-repeated_risk_type_count"
      ],
      "关联证据": [